{
  "schemaVersion": 1,
  "organization": {
    "schoolName": "範例大學",
    "unitName": "通識教育中心",
    "timeZone": "Asia/Taipei"
  },
  "course": {
    "name": "AI 與社會專題演講",
    "semester": "115-1",
    "room": "人文大樓 A101",
    "talkCount": 10
  },
  "schedule": {
    "termStart": "2026-09-07",
    "termEnd": "2027-01-08",
    "weekday": 3,
    "startTime": "14:00",
    "endTime": "17:00",
    "excludedDates": [
      {
        "date": "2026-09-30",
        "reason": "範例停課日"
      }
    ]
  },
  "features": {
    "speakerLibrary": true,
    "tasks": true,
    "backup": true
  },
  "needsConfirmation": []
}

